numero_norma,version,sumilla,tipo,estado,sistema,fecha_publicacion,fecha_emision,enlace
Resolución SBS N° 01219-2026,v1.0,Aprueban la Guía de identificación y reporte de alertas aplicable a los sujetos obligados a informar a la UIF-Perú a que hace referencia el artículo 3 de la Ley N°29038 y dictan otras disposiciones,Resolución,Vigente,"LA/FT_SBS, LA/FT_UIF, LA/FT_otros",24/04/2026,22/04/2026,https://www.sbs.gob.pe/app/pp/INT_CN/Paginas/Busqueda/Download.aspx?url=p8ehJETNq5hYZsadCTQlDA1Pw7aAvNcREl6DVQhESNiouiM3fzeprEeqSY0+Ubw+IMYa9V8Zay/mgvD1uvX66Ar+LIbOKeBV02kcyJ2IZ6tqG9iR/URv5XmCBPeftastkCDeOgCsTfR6TjZb3ofXxbBLM0UzNDpAZKSUbpUD+/r5p67/rWyzfPmxrxhZfNRl+hvM96Juu55s7G696NHaqP/16d8WU2j1aFuYb7/bhOc=
Resolución SBS N° 1029-2026,v1.0,Modifican el Reglamento de Infracciones y Sanciones de la Superintendencia de Banca Seguros y Administradoras Privadas de Fondos de Pensiones.,Resolución,Vigente,"SF, SS, SPP, COOPAC, LA/FT_SBS",10/04/2026,08/04/2026,https://www.sbs.gob.pe/app/pp/INT_CN/Paginas/Busqueda/Download.aspx?url=p8ehJETNq5hYZsadCTQlDA1Pw7aAvNcREl6DVQhESNiouiM3fzeprEeqSY0+Ubw+IMYa9V8Zay/mgvD1uvX66Ar+LIbOKeBV02kcyJ2IZ6vJTDguJSaJkiOj1Y4yvEQV+VQ1PQuvvqxOFlb6HVGCmPUSTkxh6Che6kn7TPYq+TkIi7tJzhrIEdsYGIn0fBdFct3RJ6PzGHaCvqlGock84Q==
Resolución SBS N° 2868-2025,v1.0,Modifican el artículo 2 y el Anexo de la Norma sobre funciones y cargos ocupados por personas expuestas políticamente (PEP) en materia de prevención del lavado de activos y del financiamiento del terrorismo aprobada por la Resolución SBS N° 4349-2016.,Resolución,Vigente,"LA/FT_SBS, LA/FT_UIF, LA/FT_otros",16/08/2025,14/08/2025,https://www.sbs.gob.pe/app/pp/INT_CN/Paginas/Busqueda/Download.aspx?url=p8ehJETNq5hYZsadCTQlDA1Pw7aAvNcREl6DVQhESNiouiM3fzeprEeqSY0+Ubw+IMYa9V8Zay/mgvD1uvX66Ar+LIbOKeBV02kcyJ2IZ6vJZNK/xy79MqGzwckOlbnEt/5Qs5Gki2v09UXWUvH2Sjs6ZAliFCBl8y2OLfhLy7Fj0ETmkqaYUn9KpbvlWlK1a4YPqMJGvfU1DpXVTmTjUMKwgzz6syCDtMC3iUJ5Ly78AwAJvxCrez78fq7mQI/o
Resolución SBS N° 00199-2025,v1.0,"Modifican la Norma sobre funciones y cargos ocupados por personas expuestas políticamente (PEP) en materia de prevención del lavado de activos y del financiamiento del terrorismo, aprobada mediante Resolución SBS N° 4349-2016.",Resolución,Vigente,"LA/FT_SBS, LA/FT_UIF, LA/FT_otros",22/01/2025,20/01/2025,https://www.sbs.gob.pe/app/pp/INT_CN/Paginas/Busqueda/Download.aspx?url=p8ehJETNq5hYZsadCTQlDA1Pw7aAvNcREl6DVQhESNiouiM3fzeprEeqSY0+Ubw+IMYa9V8Zay/mgvD1uvX66Ar+LIbOKeBV02kcyJ2IZ6sm+QeDwFENnkhlmcDs7/tGSSga+0KZjvSFOYXMSVCzRhOTzpVflrpcmK7K1Rj7ly/CxKhezL2l38e7fau4DwEGyil+xSyMg0SxxwznTLTKWxbGjaUZgWcwwiEdCGsPEFI=
Resolución SBS N° 3141-2024,v2.0,"Aprueban la Norma que regula los servicios que brinda la SBS a los ciudadanos y la atención de denuncias contra las empresas supervisadas, y modifican el TUPA de la Superintendencia de Banca, Seguros y Administradoras Privadas de Fondos de Pensiones.",Resolución,Vigente,"SF, SS, SPP, COOPAC, AFOCAT, LA/FT_SBS",09/09/2024,06/09/2024,https://www.sbs.gob.pe/app/pp/INT_CN/Paginas/Busqueda/Download.aspx?url=p8ehJETNq5hYZsadCTQlDA1Pw7aAvNcREl6DVQhESNiouiM3fzeprEeqSY0+Ubw+IMYa9V8Zay/mgvD1uvX66Ar+LIbOKeBV02kcyJ2IZ6twbgP3zQ3E9CWdAI/3FIkK1k/cROb8TnK1a/eagQZfpILdVxJnVpEornpPLnfbGZCfhZU8c1TzD/MnSwzngefw
Resolución SBS N° 3348-2022,v3.0,"Modifican el inciso e) del artículo 3 e incluir el artículo 8 a la Norma que regula el procedimiento de atención de las solicitudes de levantamiento del secreto bancario, aprobada por Resolución SBS N° 1132-2015.",Resolución,Vigente,"SF, LA/FT_SBS",08/11/2022,04/11/2022,https://www.sbs.gob.pe/app/pp/INT_CN/Paginas/Busqueda/Download.aspx?url=p8ehJETNq5hYZsadCTQlDA1Pw7aAvNcREl6DVQhESNiouiM3fzeprEeqSY0+Ubw+IMYa9V8Zay/mgvD1uvX66Ar+LIbOKeBV02kcyJ2IZ6ttdj7411VjN4TJgyAxrKv8Ppct36+tI7VU9NO3S9oMezd7nVeU0ce4VgbFobUmfcqnl19eWcNeYxupvdLxWfb1IWlhGkGajBlczDimuG2RvA==
Resolución SBS N° 3347-2022,v1.0,Incorporan Octava Disposición Final en el Reglamento de Auditoría Externa aprobado por la Resolución SBS N° 17026-2010 y sus modificatorias,Resolución,Vigente,"SF, SS, SPP, LA/FT_SBS",07/11/2022,04/11/2022,https://www.sbs.gob.pe/app/pp/INT_CN/Paginas/Busqueda/Download.aspx?url=p8ehJETNq5hYZsadCTQlDA1Pw7aAvNcREl6DVQhESNiouiM3fzeprEeqSY0+Ubw+IMYa9V8Zay/mgvD1uvX66Ar+LIbOKeBV02kcyJ2IZ6s/dP3T/lgp1HJ/mrL7fWm5HM+/cRt7zP8p55uE/nnhFaiBM1e/oMLh03Yg4TZy90vl/WPMOE2qqg2AM7Z2HLeGlL9RjWEWW+Z0RIMMrChudA==
Resolución SBS N° 2610-2021,v1.0,Modifican la Norma que regula los mecanismos y procedimientos para que la UIF-Perú congele administrativamente los fondos u otros activos de las personas o entidades vinculadas al terrorismo y al financiamiento del terrorismo así como de aquellas vinculadas a la proliferación de armas de destrucción masiva y su financiamiento.,Resolución,Vigente,"SF, SS, SPP, LA/FT_SBS, LA/FT_UIF, LA/FT_otros",07/09/2021,06/09/2021,https://www.sbs.gob.pe/app/pp/INT_CN/Paginas/Busqueda/Download.aspx?url=p8ehJETNq5hYZsadCTQlDA1Pw7aAvNcREl6DVQhESNiouiM3fzeprEeqSY0+Ubw+IMYa9V8Zay/mgvD1uvX66Ar+LIbOKeBV02kcyJ2IZ6uWpaUqMEpZ3PESkDjtS7TdB1UB8CmmqbzcbNzGNtqCyuZqlodpQ7ErOMGk1olOG1G38x9nsc5MU1vm1OZGcCIi7EHABZiH7RZCQbF6CFWMLg==
Resolución SBS N° 3292-2020,v1.0,Modifican el artículo 1 de la Resolución SBS N° 1743-2020.,Resolución,Vigente,LA/FT_SBS,30/12/2020,29/12/2020,https://www.sbs.gob.pe/app/pp/INT_CN/Paginas/Busqueda/Download.aspx?url=p8ehJETNq5hYZsadCTQlDA1Pw7aAvNcREl6DVQhESNiouiM3fzeprEeqSY0+Ubw+IMYa9V8Zay/mgvD1uvX66Ar+LIbOKeBV02kcyJ2IZ6tlPwioS/ltlrnPX3/ySK7cexW6iE8oK3ULxH//uT5Edoko1uHpOVnderDaN6NI5vS/ImL2oLaRodxfVBcxPqnd6Q+1GsoGwyMjDkR520+9rA==
Resolución SBS Nº 1743-2020,v2.0,Modifican la Resolución SBS Nº 3329- 2019 y el Reglamento de Gestión de Riesgos de Lavado de Activos y del Financiamiento del Terrorismo aprobado por Resolución SBS Nº2660-2015.,Resolución,Vigente,"SF, SS, SPP, LA/FT_SBS",01/07/2020,30/06/2020,https://www.sbs.gob.pe/app/pp/INT_CN/Paginas/Busqueda/Download.aspx?url=p8ehJETNq5hYZsadCTQlDA1Pw7aAvNcREl6DVQhESNiouiM3fzeprEeqSY0+Ubw+IMYa9V8Zay/mgvD1uvX66PIwO9B2GmahyzPxCppervrgYAHQj7Eut6RDXWwsipQV4Ow3nZrneBIjz9KclzMNJIwemOuwvcFkAOzcssWZwvfBW3CwIwY7TkEEBBOk9HTkgwO36UBUzxMgeqCss7Bfkw==
Resolución SBS N° 1537-2020,v1.0,Amplían suspensión del cómputo de plazos administrativos relacionados con funciones y atribuciones de la SBS y dictan diversas disposiciones,Resolución,Vigente,"SF, SS, SPP, COOPAC, AFOCAT, LA/FT_SBS",08/06/2020,05/06/2020,https://www.sbs.gob.pe/app/pp/INT_CN/Paginas/Busqueda/Download.aspx?url=p8ehJETNq5hYZsadCTQlDA1Pw7aAvNcREl6DVQhESNiouiM3fzeprEeqSY0+Ubw+IMYa9V8Zay/mgvD1uvX66PIwO9B2GmahyzPxCppervoWO26VYYTSlq6iCr0Bq7jICf4SoDxKJ5JUzRJE4aPWUw/8qR3b0/cvsDQANKDMqIwAVMGA7zA+LTIP4qmc9HxxxsMYda4ZNNYdd3Qv20i1cw==
Resolución SBS Nº 1407-2020,v1.0,Amplían la suspensión del cómputo de plazos dispuesta mediante Resolución SBS Nº 1259- 2020 y dictan otras disposiciones.,Resolución,Vigente,"SF, SS, SPP, COOPAC, AFOCAT, LA/FT_SBS",26/05/2020,25/05/2020,https://www.sbs.gob.pe/app/pp/INT_CN/Paginas/Busqueda/Download.aspx?url=p8ehJETNq5hYZsadCTQlDA1Pw7aAvNcREl6DVQhESNiouiM3fzeprEeqSY0+Ubw+IMYa9V8Zay/mgvD1uvX66PIwO9B2GmahyzPxCppervr0/rHTWwgULf1JXQG1FTjf2bZw71dycnP4ISBLyKWP7t1Qc1RxzVZgd+hOTApswtmNmZ6EQoujLQznPKhDMFtwEDDPRl1uc1h1VBtEMFMToQ==
Resolución SBS N° 1311-2020,v1.0,"Se amplía la suspensión del cómputo de plazos dispuesta mediante Res. SBS N° 1259-2020, relacionados con funciones, atribuciones y entrega de información de la SBS, hasta el 10 de mayo de 2020 inclusive.",Resolución,Vigente,"SF, SS, SPP, COOPAC, AFOCAT, LA/FT_SBS",27/04/2020,25/04/2020,https://www.sbs.gob.pe/app/pp/INT_CN/Paginas/Busqueda/Download.aspx?url=p8ehJETNq5hYZsadCTQlDA1Pw7aAvNcREl6DVQhESNiouiM3fzeprEeqSY0+Ubw+IMYa9V8Zay/mgvD1uvX66PIwO9B2GmahyzPxCppervp2837kW3qL2IGxI/wdgINrrvb6TK9MCIDD1RDXsTUU0kaENtaCPYJsthIoTJ5PJ2SN6JcJC8ARlVeSpYh+Gshs4mC8/uw3cQv+gzU4eYOZxQ==
Resolución SBS N° 1280-2020,v1.0,Amplían suspensión del cómputo de plazos a los que se refiere la Resolución de Superintendencia Nº 1268-2020.,Resolución,Vigente,"SF, SS, SPP, COOPAC, AFOCAT, LA/FT_SBS",14/04/2020,11/04/2020,https://www.sbs.gob.pe/app/pp/INT_CN/Paginas/Busqueda/Download.aspx?url=p8ehJETNq5hYZsadCTQlDA1Pw7aAvNcREl6DVQhESNiouiM3fzeprEeqSY0+Ubw+IMYa9V8Zay/mgvD1uvX66PIwO9B2GmahyzPxCppervrQ/CA0G8EfAqQXDvfGaJqXv8HvQee0+5VjfOmtNNDRNtM96R9g15I1yVv83brmvJ7oLv64Vk1fS7xGRCjYbsBJJrEL+xlqmeph0NBE3n32xw==
Resolución SBS N° 1268-2020,v1.0,"Amplían la suspensión del cómputo de plazos administrativos relacionados con las funciones y atribuciones que corresponden a la SBS, incluyendo los establecidos a los que se refieren los artículos 252 y 253 del TUO de la Ley N° 27444.",Resolución,Vigente,"SF, SS, SPP, COOPAC, AFOCAT, LA/FT_SBS",29/03/2020,27/03/2020,https://www.sbs.gob.pe/app/pp/INT_CN/Paginas/Busqueda/Download.aspx?url=p8ehJETNq5hYZsadCTQlDA1Pw7aAvNcREl6DVQhESNiouiM3fzeprEeqSY0+Ubw+IMYa9V8Zay/mgvD1uvX66PIwO9B2GmahyzPxCppervoVmWKNktG41WtqqBJQNo6THYwMg1S7VtYe99PRtpV5mtAInWMrWRV8oNopCjDDJ0dPOA7CpTGwa1fUYida7ghKK5/3/ZtQL+zSltPuYrrHXg==
Resolución SBS N° 1259-2020,v1.0,"Suspensión de plazos administrativos relacionados con las funciones y atribuciones que corresponden a esta Superintendencia, en el marco del ¿Estado de Emergencia Nacional¿ (Decreto Supremo N° 044-2020-PCM )",Resolución,Vigente,"SF, SS, SPP, COOPAC, AFOCAT, LA/FT_SBS",20/03/2020,16/03/2020,https://www.sbs.gob.pe/app/pp/INT_CN/Paginas/Busqueda/Download.aspx?url=p8ehJETNq5hYZsadCTQlDA1Pw7aAvNcREl6DVQhESNiouiM3fzeprEeqSY0+Ubw+IMYa9V8Zay/mgvD1uvX66PIwO9B2GmahyzPxCppervpVeFFAfBXRrJevDFjPinrGsOnkST+R0Z7ErO5Gii7zoomgpBQtz7hYRbFtmsN5vdCvvuCmKqyD7qh3vvV4VG6QBY7cSoAMCG5O/Ua1X1TV3w==
Resolución SBS N° 3949-2019,v1.0,"Se aprueba la Plantilla ROSEL que deben utilizar sujetos obligados a informar a que se refieren la Ley N° 29038 y el D.S. N° 020-2017-JUS, para cumplir con su obligación de comunicar a la UIF-Perú y dictan otras disposiciones",Resolución,Vigente,"LA/FT_SBS, LA/FT_UIF, LA/FT_superv, LA/FT_otros, LA/FT_grles",04/09/2019,28/08/2019,https://www.sbs.gob.pe/app/pp/INT_CN/Paginas/Busqueda/Download.aspx?url=p8ehJETNq5hYZsadCTQlDA1Pw7aAvNcREl6DVQhESNiouiM3fzeprEeqSY0+Ubw+IMYa9V8Zay/mgvD1uvX66PIwO9B2GmahyzPxCppervrrfW9+k3RFlOmdRqFqa59Ugj6axxtafRsvGXdOl2K+eviNQLzc3SrMXJFPgFyU/A1NVebxcn9qzuA7spEnPRJQVEP/SwYLoOQ/sA79+4tMXQ==
Resolución SBS N° 3329-2019,v2.0,"Aprueban instrucciones para la presentación del Registro de Operaciones Únicas y Múltiples (Instructivo RO) aplicable a sujetos obligados bajo el alcance de la Res. SBS N° 2660-2015, modifican el artículo 49 del Reglamento de Gestión de Riesgos de Lavado de Activos y del Financiamiento del Terrorismo, y dictan otras disposiciones.",Resolución,Vigente,"SF, SS, SPP, LA/FT_SBS",20/07/2019,17/07/2019,https://www.sbs.gob.pe/app/pp/INT_CN/Paginas/Busqueda/Download.aspx?url=p8ehJETNq5hYZsadCTQlDA1Pw7aAvNcREl6DVQhESNiouiM3fzeprEeqSY0+Ubw+IMYa9V8Zay/mgvD1uvX66PIwO9B2GmahyzPxCppervojhfaQ4UyvvOANYvC6sOXJL7HpnIjpBvdm91JORgwYq8/opv1k4aAHHwJrS+44X+HvYRUTA6PEPYxP3WtPwuWIGdLZ2DjlLYpHmnFLowosYQ==
Resolución SBS N° 310-2019,v1.0,"Se modifican diversas infracciones de los Anexos 1, 2, 3 y 4 del Reglamento de Infracciones y Sanciones de la Superintendencia de Banca, Seguros y Administradoras Privadas de Fondos de Pensiones.",Resolución,Vigente,"SF, SS, SPP, LA/FT_SBS",25/01/2019,23/01/2019,https://www.sbs.gob.pe/app/pp/INT_CN/Paginas/Busqueda/Download.aspx?url=p8ehJETNq5hYZsadCTQlDA1Pw7aAvNcREl6DVQhESNiouiM3fzeprEeqSY0+Ubw+IMYa9V8Zay/mgvD1uvX66PIwO9B2GmahyzPxCppervrh1Ftljhu0UUnlaZfs10cYluE7w5iteRb2ucfwMCyQi9Zdfn/1yJiLNGZ/ijDOtxeIfLGke1IV90r8n0FQQxBtu/KyhKbfVRmVOns2NY9Agg==
Resolución SBS N° 5060-2018,v1.0,Reglamento para la prevención del lavado de activos y del financiamiento del terrorismo aplicable a las Cooperativas de Ahorro y Crédito no autorizadas a operar con recursos del público,Resolución,Vigente,"LA/FT_SBS, LA/FT_UIF",28/12/2018,26/12/2018,https://www.sbs.gob.pe/app/pp/INT_CN/Paginas/Busqueda/Download.aspx?url=p8ehJETNq5hYZsadCTQlDA1Pw7aAvNcREl6DVQhESNiouiM3fzeprEeqSY0+Ubw+IMYa9V8Zay/mgvD1uvX66PIwO9B2GmahyzPxCppervqIJL7ANAf7fI83+LnLdq41iNMtnY0eoaBJaHwZbrxdntb/cIO6P6R3G2o6rS92T+faRgwvFsqT5AkenBtDhbep
Resolución SBS N° 2755-2018,v33.0,"Reglamento de Infracciones y Sanciones de la Superintendencia de Banca, Seguros y Administradoras Privadas de Fondos de Pensiones",Resolución,Vigente,"SF, SS, SPP, LA/FT_SBS",17/07/2018,16/07/2018,https://www.sbs.gob.pe/app/pp/INT_CN/Paginas/Busqueda/Download.aspx?url=p8ehJETNq5hYZsadCTQlDA1Pw7aAvNcREl6DVQhESNiouiM3fzeprEeqSY0+Ubw+IMYa9V8Zay/mgvD1uvX66PIwO9B2GmahyzPxCppervpxa2qdj4mwf3W6CRBS9km+4/zRctE4mYfW8V31XfzzBKCrj2tsz0NeesC+pW2VjjgOVtwR7DFYQYhzzALTuw4mDv38wq+WInlqCzrtQ6kKxnwKU3aeY+flKABz0BEugdM=
Oficio Múltiple N° 11273-2018-SBS,v1.0,Precisiones al Reglamento de Gestión de Riesgos de Lavado de Activos y del Financiamiento del Terrorismo,Oficio múltiple,Vigente,"SS, LA/FT_SBS",,28/03/2018,https://www.sbs.gob.pe/app/pp/INT_CN/Paginas/Busqueda/Download.aspx?url=p8ehJETNq5hYZsadCTQlDA1Pw7aAvNcREl6DVQhESNiouiM3fzeprEeqSY0+Ubw+IMYa9V8Zay/mgvD1uvX66Ar+LIbOKeBV02kcyJ2IZ6v8Ue++dGXlif2Yv2GrBVXIYMJXWPfUVz4HbG25gxRriiqRxBu5sc5OXGPUDzUpzniJQ3f/9crk3l/3HeKgA6Ld9KkX3+zBUTBushmGEjgyqg==
Resolución SBS N° 4705-2017,v1.0,Modifican el Reglamento de Gestión de Riesgos de Lavado de Activos y del Financiamiento del Terrorismo. (Ver plazos de adecuación establecidos en el artículo 2°),Resolución,Vigente,"SF, SS, SPP, LA/FT_SBS, LA/FT_UIF",11/12/2017,06/12/2017,https://www.sbs.gob.pe/app/pp/INT_CN/Paginas/Busqueda/Download.aspx?url=p8ehJETNq5hYZsadCTQlDA1Pw7aAvNcREl6DVQhESNiouiM3fzeprEeqSY0+Ubw+IMYa9V8Zay/mgvD1uvX66PIwO9B2GmahyzPxCppervpiykx7kxZqYnJlAhvCmq2susJDMY2d82z0niAlOeAOgva1IzP//eqPmvAm01CelEI13T1upqgOuRLSCsYdoM3Y
Resolución SBS N° 1515-2017,v1.0,Suspenden la aplicación de plazos referidos a la presentación de avisos de siniestros y a los procesos de atención de siniestros ocurridos en las zonas del país declaradas en Estado de Emergencia.,Resolución,Vigente,"SF, SS, SPP, LA/FT_SBS, LA/FT_UIF, LA/FT_superv, LA/FT_otros, LA/FT_grles",13/04/2017,12/04/2017,https://www.sbs.gob.pe/app/pp/INT_CN/Paginas/Busqueda/Download.aspx?url=p8ehJETNq5hYZsadCTQlDA1Pw7aAvNcREl6DVQhESNiouiM3fzeprEeqSY0+Ubw+IMYa9V8Zay/mgvD1uvX66PIwO9B2GmahyzPxCppervrFOmLTiGqoQhdMjgcPGS48BIhZufP1cCL6W8Ogpv8LbcFN8W53ojUYmpzMIOSx0B0JXIYrA8jJBO4GqJsEM2Pqf7szL+rUy1fnqYF3uY51tw==
Resolución SBS N° 4349-2016,v3.0,Norma sobre funciones y cargos ocupados por personas expuestas políticamente (PEP) en materia de prevención del lavado de activos y del financiamiento del terrorismo.,Resolución,Vigente,"LA/FT_SBS, LA/FT_UIF, LA/FT_otros",14/08/2016,11/08/2016,https://www.sbs.gob.pe/app/pp/INT_CN/Paginas/Busqueda/Download.aspx?url=p8ehJETNq5hYZsadCTQlDA1Pw7aAvNcREl6DVQhESNiouiM3fzeprEeqSY0+Ubw+IMYa9V8Zay/mgvD1uvX66PIwO9B2GmahyzPxCppervqV15oZhwbMvNXQ/NbYt+3WITqc9u87gvDZxWgnNCxRU7PYkUvlvC8FEd3H1kNYovI21jU0ehkmVsH6n9WXcVrWZYHtns5JF04f56f+5zx6txfv4/WFYogouAtLBiM33eZ89eHnXTa1F6ISI4p9au21
Resolución SBS N° 3880-2016,v1.0,Modifican el artículo 4° de la Norma que regula el procedimiento de atención de las solicitudes de levantamiento del secreto bancario aprobada por Res. SBS N° 1132-2015,Resolución,Vigente,"SF, LA/FT_SBS",18/07/2016,14/07/2016,https://www.sbs.gob.pe/app/pp/INT_CN/Paginas/Busqueda/Download.aspx?url=p8ehJETNq5hYZsadCTQlDA1Pw7aAvNcREl6DVQhESNiouiM3fzeprEeqSY0+Ubw+IMYa9V8Zay/mgvD1uvX66PIwO9B2GmahyzPxCppervrBGP2u/+GBLpfnXKF/cq3lR0/UlBVk0uiVxUzIE+bI86nW/KayOaVjcLS8fmH2vb45xWS1Fv++a0zXXepCWMaX
Resolución SBS N° 3862-2016,v3.0,"Aprueban Norma que regula los mecanismos y procedimientos para que la UIF - Perú congele administrativamente los fondos u otros activos de las personas o entidades vinculadas al terrorismo y al financiamiento del terrorismo, así como de aquellas vinculadas a la proliferación de armas de destrucción masiva y su financiamiento, identificadas en el marco de las Resoluciones del Consejo de Seguridad de las Naciones Unidas.",Resolución,Vigente,"SF, SS, SPP, LA/FT_SBS, LA/FT_UIF, LA/FT_otros",16/07/2016,13/07/2016,https://www.sbs.gob.pe/app/pp/INT_CN/Paginas/Busqueda/Download.aspx?url=p8ehJETNq5hYZsadCTQlDA1Pw7aAvNcREl6DVQhESNiouiM3fzeprEeqSY0+Ubw+IMYa9V8Zay/mgvD1uvX66PIwO9B2GmahyzPxCppervryxyNwRDa3M09O1sydkttH22jW/PVmBjwEn6ibb6eQs7irXO35XssKZKJraBaDtsH0cMLoqPY/I1PCnda60Fu48xAItSLRKUt93nqDAvoSiA==
Resolución SBS N° 4623-2015.,v1.0,"Modificación de procedimientos administrativos N°s 138 y 140 del TUPA de la SBS, relativos a solicitudes de designación de Oficiales de Cumplimiento.",Resolución,Vigente,"SF, SS, SPP, LA/FT_SBS, LA/FT_otros",14/08/2015,12/08/2015,https://www.sbs.gob.pe/app/pp/INT_CN/Paginas/Busqueda/Download.aspx?url=p8ehJETNq5hYZsadCTQlDA1Pw7aAvNcREl6DVQhESNiouiM3fzeprEeqSY0+Ubw+IMYa9V8Zay/mgvD1uvX66PIwO9B2GmahyzPxCppervqsLiQOUea3JquoLCwQES2wxqApccAAWq3o0Tty+v81Y2HVMg2IgVw0QXFFfs6SEYj6lazOb+dBiEogAeyAzA1X
Resolución SBS N° 2940-2015,v1.0,"Incorpora infracción en la Sección II ""Infracciones Graves"" del Anexo 2 ""infracciones específicas del Sistema Financiero y de las Empresas de Servicios Complementarios y Conexos"" del Reglamento de Sanciones aprobado por la Resolución SBS N° 816-2015.",Resolución,Vigente,"SF, LA/FT_SBS",30/05/2015,26/05/2015,https://www.sbs.gob.pe/app/pp/INT_CN/Paginas/Busqueda/Download.aspx?url=p8ehJETNq5hYZsadCTQlDA1Pw7aAvNcREl6DVQhESNiouiM3fzeprEeqSY0+Ubw+IMYa9V8Zay/mgvD1uvX66PIwO9B2GmahyzPxCppervoN05LV8OaBZ+G5fYd0UPB3R1b9wfXKMgEC64c5eikF5rK1/qblcEsfkagqkh3tOuvKpMciUW2p/n/64xIvJPGL
Resolución SBS N° 2660-2015,v5.0,Reglamento de Gestión de Riesgos de Lavado de Activos y del Financiamiento del Terrorismo (Ver plazos de adecuación establecidos en el artículo 2° de la Resolución SBS N° 4705-2017 ),Resolución,Vigente,"SF, SS, SPP, LA/FT_SBS",18/05/2015,14/05/2015,https://www.sbs.gob.pe/app/pp/INT_CN/Paginas/Busqueda/Download.aspx?url=p8ehJETNq5hYZsadCTQlDA1Pw7aAvNcREl6DVQhESNiouiM3fzeprEeqSY0+Ubw+IMYa9V8Zay/mgvD1uvX66PIwO9B2GmahyzPxCppervr03LPtWW0XleQXwu/6CZonP7AMusrCRK+BGn2afHwVGxl76r1CAIuvKCcYqOX+Ddm5uESy2NsUi4WGkZazs43ZTYg4FwPPH3U1j2709QvDyg==
Resolución SBS N° 1132-2015,v5.0,Norma que regula el procedimiento de atención de las solicitudes de levantamiento del secreto bancario,Resolución,Vigente,"SF, LA/FT_SBS",16/02/2015,12/02/2015,https://www.sbs.gob.pe/app/pp/INT_CN/Paginas/Busqueda/Download.aspx?url=p8ehJETNq5hYZsadCTQlDA1Pw7aAvNcREl6DVQhESNiouiM3fzeprEeqSY0+Ubw+IMYa9V8Zay/mgvD1uvX66PIwO9B2GmahyzPxCppervrGF5BkNP+YREWM95VDHmjXh5F/qyfqBMa4Ct8J5uFpT8RidcGgKf8+JSJzEAxIIsYsDulidP8zg/Jm76h7Kg4XVJBBMqkY7vAOd+Bno+Nynw==
Resolución SBS N° 289-2015.,v1.0,"Establecen medio electrónico a través del cual las empresas señaladas en los artículos 16° y 17° de la Ley N° 26702 y las Cooperativas de Ahorro y Crédito no autorizadas a operar con recursos del público, remitirán los informes semestrales del oficial de cumplimiento (ISOC) a la UIF-Perú.",Resolución,Vigente,"SF, SS, LA/FT_SBS",17/01/2015,14/01/2015,https://www.sbs.gob.pe/app/pp/INT_CN/Paginas/Busqueda/Download.aspx?url=p8ehJETNq5hYZsadCTQlDA1Pw7aAvNcREl6DVQhESNiouiM3fzeprEeqSY0+Ubw+IMYa9V8Zay/mgvD1uvX66PIwO9B2GmahyzPxCppervoykL1TPMwALMYEYwLVSNqi1HnhswQYq/oLdoLI2I9eQmqngKpY8lxRCcehvAJwtH0XYmyiyHXKEP1WX1JuyAUxwz7QmrlP9attglaPiYfShQ==
Resolución SBS N° 6414-2014,v3.0,Aprueban norma que establece los requisitos y características de los Reportes de Operaciones Sospechosas (ROS) que los organismos supervisores de los sujetos obligados a informar emitan a la UIF-Perú.,Resolución,Vigente,"LA/FT_SBS, LA/FT_superv",28/09/2014,26/09/2014,https://www.sbs.gob.pe/app/pp/INT_CN/Paginas/Busqueda/Download.aspx?url=p8ehJETNq5hYZsadCTQlDA1Pw7aAvNcREl6DVQhESNiouiM3fzeprEeqSY0+Ubw+IMYa9V8Zay/mgvD1uvX66PIwO9B2GmahyzPxCppervqs2tchsH1NoFVzNNXELDUV2J9vstcIiKz0T/bMlJK3/XiYdQRbR/aq3E2TGVtr2mm8921TeEECTftNHnoY1KUMuisCC4saBHEypHslLcxWhQ==
Resolución SBS N° 1214-2014,v1.0,Modifica el artículo 12A° de las Normas Complementarias para la Prevención del Lavado de Activos y del Financiamiento del Terrorismo.,Resolución,Vigente,"SF, SS, SPP, LA/FT_SBS",28/02/2014,24/02/2014,https://www.sbs.gob.pe/app/pp/INT_CN/Paginas/Busqueda/Download.aspx?url=p8ehJETNq5hYZsadCTQlDA1Pw7aAvNcREl6DVQhESNiouiM3fzeprEeqSY0+Ubw+IMYa9V8Zay/mgvD1uvX66PIwO9B2GmahyzPxCppervqx/rkfrbpN84vddqky3M+iEguwulJku/p7iFUZPIgAQOpviQ4DLqiw+RRTkFEnstR+jTizuGq6blMFRKXENXpU9Lf87YUwYkIavx76Iewpig==
Resolución SBS N° 3091-2011,v1.0,Modifican Reglamento de Infracciones y Sanciones en materia de prevención de lavado de activos y de financiamiento de terrorismo aprobado por Resolución SBS N° 1782-2007 y el Anexo I del Reglamento de Sanciones aprobado mediante Resolución SBS N° 816-2005.,Resolución,Vigente,"SF, SS, SPP, LA/FT_SBS",18/03/2011,15/03/2011,https://www.sbs.gob.pe/app/pp/INT_CN/Paginas/Busqueda/Download.aspx?url=p8ehJETNq5hYZsadCTQlDA1Pw7aAvNcREl6DVQhESNiouiM3fzeprEeqSY0+Ubw+IMYa9V8Zay/mgvD1uvX66AEoXqganhz45SnR9qdBiDIFBEC5GpJNwx9715tz9qCqU2xlQVvrP5tGMoY7jKMfOjtBl3Y8goMAbpjXyFWjy+tUKCfAqp3Sus5kHxTqlpUDdOEiccKuCNe/rdVSCOSnfw==
Resolución SBS N° 17025-2010,v1.0,Aprueba el Reglamento del Registro de Sociedades de Auditoría Externa,Resolución,Vigente,"SF, SS, SPP, LA/FT_SBS",15/12/2010,10/12/2010,https://www.sbs.gob.pe/app/pp/INT_CN/Paginas/Busqueda/Download.aspx?url=p8ehJETNq5hYZsadCTQlDA1Pw7aAvNcREl6DVQhESNiouiM3fzeprEeqSY0+Ubw+IMYa9V8Zay/mgvD1uvX66CbDc21bQWqfe7DYRktqx2SnK384RfMyEMFKQNdL6UK2eKDrY5BaQT8AwUnXAZs8YboKmgGROV6qsfpj4nhNaWMVQruSkcNXTOjVQPUk3LsyOIFEwmgCg/sSnKWi+aW+Zg==
Resolución SBS N° 17026-2010,v15.0,Aprueba el Reglamento de Auditoría Externa (incluye anexos del Reglamento).,Resolución,Vigente,"SF, SS, SPP, LA/FT_SBS",15/12/2010,10/12/2010,https://www.sbs.gob.pe/app/pp/INT_CN/Paginas/Busqueda/Download.aspx?url=p8ehJETNq5hYZsadCTQlDA1Pw7aAvNcREl6DVQhESNiouiM3fzeprEeqSY0+Ubw+IMYa9V8Zay/mgvD1uvX66CbDc21bQWqfe7DYRktqx2QPRc7BSk08xlXjs3HGH5QB6soePgsbo/lZpGf3WgobuBtahYocdbDRR5A85GZTlo/6CUoO+YECcDvPru7SWJG8gkUyLiFXGZLYPDMEtAUuEQ==
Circular G-148-2010,v1.0,Establece prórroga para los primeros envíos del Registro de Operaciones (RO) y de la Relación de Operaciones en Efectivo del Registro de Operaciones (ROPE).,Circular,Vigente,"SF, SS, SPP, LA/FT_SBS",13/04/2010,12/04/2010,https://www.sbs.gob.pe/app/pp/INT_CN/Paginas/Busqueda/Download.aspx?url=p8ehJETNq5hYZsadCTQlDA1Pw7aAvNcREl6DVQhESNiouiM3fzeprEeqSY0+Ubw+IMYa9V8Zay/mgvD1uvX66PIwO9B2GmahyzPxCppervod5CMvMC0jNHzwUEVw66SQMJz64s7bHJ1PbkRkxN+NGuJwED23qnNbLbD1F6MsXJwVaB9p+qoLUk9uVSKXN7JE0EJc0dXvqhep/+Uj1vYn7g==
Circular G-145-2009,v1.0,Determina plazo para el envío del Registro de Operaciones (RO) y de la Relación de Operaciones en Efectivo del Registro de Operaciones (ROPE),Circular,Vigente,"SF, SS, SPP, LA/FT_SBS",30/12/2009,28/12/2009,https://www.sbs.gob.pe/app/pp/INT_CN/Paginas/Busqueda/Download.aspx?url=p8ehJETNq5hYZsadCTQlDA1Pw7aAvNcREl6DVQhESNiouiM3fzeprEeqSY0+Ubw+IMYa9V8Zay/mgvD1uvX66Ar+LIbOKeBV02kcyJ2IZ6sG3C3cBJhrAr15o3V/bZrUY2hu5Mw8tpKqE8bVmBFuwvjXZC63/JMcGv0sL01NWpIvyNX8ln1M54Pj3zSA4euTShyjIX8rhYF5x8kl1JQ7Yg==
Resolución SBS N° 12565-2009,v1.0,Aprueba lineamientos para la difusión de las Resoluciones del Consejo de Seguridad de la Organización de las Naciones Unidas relativas a la prevención y supresión del financiamiento del terrorismo,Resolución,Vigente,"SF, SS, SPP, LA/FT_SBS",10/09/2009,07/09/2009,https://www.sbs.gob.pe/app/pp/INT_CN/Paginas/Busqueda/Download.aspx?url=p8ehJETNq5hYZsadCTQlDA1Pw7aAvNcREl6DVQhESNiouiM3fzeprEeqSY0+Ubw+IMYa9V8Zay/mgvD1uvX66PIwO9B2GmahyzPxCppervp1feUtIB1OEIrK+k3r34ujcjsxywn2/7drUL4SneJ9nXv4+C+1Na1ee0+2ZKD+q4M5Eww8p11wtfhfODmKMm6eYDLLY0ezj9SU//EKAs0FFQ==
Resolución SBS N° 6561-2009,v1.0,Modifica las Normas Complementarias para la Prevención del Lavado de Activos y del Financiamiento del Terrorismo aprobadas por la Resolución SBS N° 838-2008.,Resolución,Vigente,"SF, SS, SPP, LA/FT_SBS",26/06/2009,22/06/2009,https://www.sbs.gob.pe/app/pp/INT_CN/Paginas/Busqueda/Download.aspx?url=p8ehJETNq5hYZsadCTQlDA1Pw7aAvNcREl6DVQhESNiouiM3fzeprEeqSY0+Ubw+IMYa9V8Zay/mgvD1uvX66MSMvjzdNs4+Jcmhb3kTVO93/HR5IfizbUYgTE4sVEZlHNGfJeDdMoTuCzHRfXPKsdYfCDdqgjO1w1RvCSfwEJXpuS21YBHsp6VMdqFZXlxKrWX+wBx00b70/9liHNUYDA==
Circular G-0131-2007,v1.0,Normas para la remisión de los informes semestrales del Oficial de Cumplimiento por medio del sistema ISOC,Circular,Vigente,"SF, SS, SPP, LA/FT_SBS",16/06/2007,13/06/2007,https://www.sbs.gob.pe/app/pp/INT_CN/Paginas/Busqueda/Download.aspx?url=p8ehJETNq5hYZsadCTQlDA1Pw7aAvNcREl6DVQhESNiouiM3fzeprEeqSY0+Ubw+IMYa9V8Zay/mgvD1uvX66Ar+LIbOKeBV02kcyJ2IZ6sjdwwdj33WpBECTYF9WdlZoOIToddwXiIEHO0fzEyF8UdM7faGEfSSFmWq7WoYceEHIX8UnBEp9AC/pg2bOiK+JNk88emDHkuIhGAtLNT7yw==
Resolución SBS N° 816-2005,v19.0,Reglamento de Sanciones para entidades supervisadas [Solo Artículo 10 vigente],Resolución,Vigente,"SF, SS, SPP, LA/FT_SBS",06/06/2005,03/06/2005,https://www.sbs.gob.pe/app/pp/INT_CN/Paginas/Busqueda/Download.aspx?url=p8ehJETNq5hYZsadCTQlDA1Pw7aAvNcREl6DVQhESNiouiM3fzeprEeqSY0+Ubw+IMYa9V8Zay/mgvD1uvX66PIwO9B2GmahyzPxCppervpTeaEFa2oXQ09X+zzCIa/El0MgaGgAaiw6ksEzo3DLNkZweFZrmZaRXD8wnFBOJ5F/4/Cop3PsP3DS+ZsO2mcnQQQkvqxDH3LG0ead16DJYw==
